{
  "schemaVersion": "responseos.secret-contract.v1",
  "contractVersion": "1.0.0",
  "environment": "staging",
  "variables": [
    {
      "name": "DATABASE_URL",
      "classification": "connection-credential",
      "required": true,
      "scope": "application-runtime",
      "environment": "staging",
      "providerOwner": "Neon",
      "serverOnly": true,
      "clientExposed": false,
      "transferableValue": false,
      "independentProductionValueRequired": true,
      "rotationRequired": true,
      "activationEffect": "Enables pooled application database access.",
      "notes": "Metadata only; the credential-bearing pooled URL is never stored in Git."
    },
    {
      "name": "DIRECT_URL",
      "classification": "connection-credential",
      "required": true,
      "scope": "application-runtime",
      "environment": "staging",
      "providerOwner": "Neon",
      "serverOnly": true,
      "clientExposed": false,
      "transferableValue": false,
      "independentProductionValueRequired": true,
      "rotationRequired": true,
      "activationEffect": "Enables direct Prisma migration access.",
      "notes": "Must be independent from DATABASE_URL and never stored in Git."
    },
    {
      "name": "RESPONSEOS_DATABASE_IDENTITY",
      "classification": "public-identifier",
      "required": true,
      "scope": "application-runtime",
      "environment": "staging",
      "providerOwner": "ResponseOS",
      "serverOnly": true,
      "clientExposed": false,
      "transferableValue": false,
      "independentProductionValueRequired": true,
      "rotationRequired": false,
      "activationEffect": "Binds non-secret database identity evidence to exact environment variable revisions.",
      "notes": "The environment-specific attestation is regenerated from readback; it is not copied."
    },
    {
      "name": "CLERK_SECRET_KEY",
      "classification": "credential",
      "required": true,
      "scope": "application-runtime",
      "environment": "staging",
      "providerOwner": "Clerk",
      "serverOnly": true,
      "clientExposed": false,
      "transferableValue": false,
      "independentProductionValueRequired": true,
      "rotationRequired": true,
      "activationEffect": "Activates server-side Clerk authentication.",
      "notes": "Staging uses a development-instance credential; Production must use a separate Production instance."
    },
    {
      "name": "NEXT_PUBLIC_CLERK_PUBLISHABLE_KEY",
      "classification": "public-identifier",
      "required": true,
      "scope": "application-runtime",
      "environment": "staging",
      "providerOwner": "Clerk",
      "serverOnly": false,
      "clientExposed": true,
      "transferableValue": false,
      "independentProductionValueRequired": true,
      "rotationRequired": false,
      "activationEffect": "Selects the browser-side Clerk instance.",
      "notes": "Client-exposed by design, but environment-specific and never copied to Production."
    },
    {
      "name": "CLERK_WEBHOOK_SECRET",
      "classification": "webhook-secret",
      "required": true,
      "scope": "application-runtime",
      "environment": "staging",
      "providerOwner": "Clerk",
      "serverOnly": true,
      "clientExposed": false,
      "transferableValue": false,
      "independentProductionValueRequired": true,
      "rotationRequired": true,
      "activationEffect": "Verifies Clerk webhook signatures before mutation.",
      "notes": "Bound to the staging webhook endpoint and Clerk development instance."
    },
    {
      "name": "AJ_DIGITAL_CLERK_ORG_ID",
      "classification": "public-identifier",
      "required": true,
      "scope": "application-runtime",
      "environment": "staging",
      "providerOwner": "Clerk",
      "serverOnly": true,
      "clientExposed": false,
      "transferableValue": false,
      "independentProductionValueRequired": true,
      "rotationRequired": false,
      "activationEffect": "Selects the AJ Digital control organization.",
      "notes": "Production ownership must be explicitly resolved against its Production Clerk instance."
    },
    {
      "name": "NEXT_PUBLIC_APP_URL",
      "classification": "configuration",
      "required": true,
      "scope": "application-runtime",
      "environment": "staging",
      "providerOwner": "ResponseOS",
      "serverOnly": false,
      "clientExposed": true,
      "transferableValue": false,
      "independentProductionValueRequired": true,
      "rotationRequired": false,
      "activationEffect": "Defines the browser-visible non-production base URL.",
      "notes": "Production must use its independently approved Production URL."
    },
    {
      "name": "RESPONSEOS_REQUIRE_AUTH",
      "classification": "configuration",
      "required": true,
      "scope": "application-runtime",
      "environment": "staging",
      "providerOwner": "ResponseOS",
      "serverOnly": true,
      "clientExposed": false,
      "transferableValue": false,
      "independentProductionValueRequired": false,
      "rotationRequired": false,
      "activationEffect": "Forces hosted authentication to fail closed.",
      "notes": "The enabled semantic must match Production; no secret value is involved."
    },
    {
      "name": "NEON_API_KEY",
      "classification": "control-secret",
      "required": true,
      "scope": "ci-workflow-control",
      "environment": "staging",
      "providerOwner": "Neon",
      "serverOnly": true,
      "clientExposed": false,
      "transferableValue": false,
      "independentProductionValueRequired": true,
      "rotationRequired": true,
      "activationEffect": "Allows protected workflow readback of the governed Neon control plane.",
      "notes": "Workflow-only; never passed to Vercel or application runtime."
    },
    {
      "name": "VERCEL_TOKEN",
      "classification": "control-secret",
      "required": true,
      "scope": "ci-workflow-control",
      "environment": "staging",
      "providerOwner": "Vercel",
      "serverOnly": true,
      "clientExposed": false,
      "transferableValue": false,
      "independentProductionValueRequired": true,
      "rotationRequired": true,
      "activationEffect": "Allows protected workflow control-plane readback and separately authorized deployment.",
      "notes": "Workflow-only and environment-scoped."
    },
    {
      "name": "VERCEL_ORG_ID",
      "classification": "public-identifier",
      "required": true,
      "scope": "ci-workflow-control",
      "environment": "staging",
      "providerOwner": "Vercel",
      "serverOnly": true,
      "clientExposed": false,
      "transferableValue": false,
      "independentProductionValueRequired": false,
      "rotationRequired": false,
      "activationEffect": "Binds workflow operations to the approved Vercel team.",
      "notes": "Identity metadata only; equality with Production is allowed by policy."
    },
    {
      "name": "VERCEL_PROJECT_ID",
      "classification": "public-identifier",
      "required": true,
      "scope": "ci-workflow-control",
      "environment": "staging",
      "providerOwner": "Vercel",
      "serverOnly": true,
      "clientExposed": false,
      "transferableValue": false,
      "independentProductionValueRequired": true,
      "rotationRequired": false,
      "activationEffect": "Binds workflow operations to the staging project.",
      "notes": "Production must use a different project identity."
    },
    {
      "name": "VERCEL_AUTOMATION_BYPASS_SECRET",
      "classification": "control-secret",
      "required": true,
      "scope": "ci-workflow-control",
      "environment": "staging",
      "providerOwner": "Vercel",
      "serverOnly": true,
      "clientExposed": false,
      "transferableValue": false,
      "independentProductionValueRequired": true,
      "rotationRequired": true,
      "activationEffect": "Allows scoped workflow smoke through Deployment Protection.",
      "notes": "Must be project-scoped and independently created for Production."
    }
  ]
}
